{
  "schemaVersion": "1.0",
  "projectId": "blog-system",
  "basePath": ".",
  "currentPhase": 2,
  "features": [
    {
      "id": "L2_blog_system_auth-001",
      "level": 2,
      "filePath": "bdd/valid-l2.feature",
      "scenarioCount": 1,
      "stateMachineId": "SM-L2-blog_system_auth",
      "tlaSpecId": "L2_blog_system_auth",
      "reqIds": ["REQ-001"],
      "designIds": ["SD-3.2.2"],
      "parentFeatureIds": ["L1_blog_system-001"],
      "siblingFeatureIds": [],
      "childFeatureIds": []
    }
  ],
  "stateMachines": [
    {
      "id": "SM-L2-blog_system_auth",
      "level": 2,
      "states": ["LoggedOut", "LoggedIn"],
      "initialState": "LoggedOut",
      "terminalStates": ["LoggedIn"],
      "acceptingStates": ["LoggedIn"],
      "rejectingStates": ["LoggedOut"],
      "transitions": [{ "from": "LoggedOut", "event": "login", "to": "LoggedIn" }],
      "invariants": ["LoggedIn => sessionValid"]
    }
  ],
  "designCoverage": {
    "totalSdNodes": 0,
    "coveredSdNodes": [],
    "uncoveredSdNodes": [],
    "coverageRate": 1
  }
}
